{
  "expected_execution_root": "{repo_root}",
  "expected_branch": "issue-422-closeout-20260420",
  "allowed_write_paths": [
    "raw/closeouts/2026-04-20-issue-422-hldpro-sim-deploy.md",
    "raw/execution-scopes/2026-04-20-issue-422-hldpro-sim-deploy-closeout-implementation.json",
    "OVERLORD_BACKLOG.md",
    "graphify-out/GRAPH_REPORT.md",
    "graphify-out/graph.json",
    "graphify-out/hldpro-governance/GRAPH_REPORT.md",
    "graphify-out/hldpro-governance/graph.json",
    "graphify-out/hldpro-governance/.graphify_ast.json",
    "graphify-out/hldpro-governance/.graphify_detect.json",
    "graphify-out/hldpro-governance/.graphify_summary.json",
    "graphify-out/hldpro-governance/community-labels.json"
  ],
  "forbidden_roots": [
    "/Users/bennibarger/Developer/HLDPRO/hldpro-governance"
  ],
  "active_parallel_roots": [
    {
      "path": "/Users/bennibarger/Developer/HLDPRO/hldpro-governance",
      "reason": "primary governance worktree on issue-385; has untracked __pycache__ and var/worktrees files"
    }
  ],
  "execution_mode": "implementation_complete",
  "lane_claim": {
    "issue_number": 422,
    "claim_ref": "https://github.com/NIBARGERB-HLDPRO/hldpro-governance/issues/422",
    "claimed_by": "session-agent-claude-sonnet-4-6",
    "claimed_at": "2026-04-20T20:20:00Z"
  },
  "handoff_evidence": {
    "status": "accepted",
    "planner_model": "claude-sonnet-4-6",
    "implementer_model": "claude-sonnet-4-6",
    "accepted_at": "2026-04-20T20:20:00Z",
    "evidence_paths": [
      "docs/plans/issue-422-hldpro-sim-deploy-structured-agent-cycle-plan.json"
    ],
    "active_exception_ref": "raw/execution-scopes/2026-04-20-issue-422-hldpro-sim-deploy-closeout-implementation.json#same-model-exception",
    "active_exception_expires_at": "2026-04-27T20:20:00Z"
  }
}
