{
  "expected_execution_root": "{repo_root}",
  "expected_branch": "codex/issue-294-downstream-governance-pilot",
  "execution_mode": "planning_only",
  "allowed_write_paths": [
    "docs/plans/issue-294-structured-agent-cycle-plan.json",
    "docs/plans/issue-294-downstream-governance-pilot-pdcar.md",
    "raw/cross-review/2026-04-18-issue-294-downstream-governance-pilot-plan.md",
    "raw/exceptions/2026-04-18-issue-294-same-family-planning.md",
    "raw/execution-scopes/2026-04-18-issue-294-downstream-governance-pilot-planning.json",
    "raw/closeouts/2026-04-18-issue-294-downstream-governance-pilot-planning.md",
    "OVERLORD_BACKLOG.md",
    "docs/PROGRESS.md",
    "graphify-out/GRAPH_REPORT.md",
    "graphify-out/graph.json",
    "graphify-out/hldpro-governance/",
    "wiki/hldpro/",
    "wiki/index.md"
  ],
  "forbidden_roots": [
    "/Users/bennibarger/Developer/HLDPRO/hldpro-governance",
    "/Users/bennibarger/Developer/HLDPRO/local-ai-machine",
    "/Users/bennibarger/Developer/HLDPRO/ai-integration-services",
    "/Users/bennibarger/Developer/HLDPRO/knocktracker",
    "/Users/bennibarger/Developer/HLDPRO/HealthcarePlatform"
  ],
  "active_parallel_roots": [
    {
      "path": "/Users/bennibarger/Developer/HLDPRO/hldpro-governance",
      "reason": "Shared main checkout contains pre-existing operator/download planning files and is not the issue #294 execution root."
    },
    {
      "path": "/Users/bennibarger/Developer/HLDPRO/local-ai-machine",
      "reason": "LAM has an active unrelated implementation lane; issue #294 plans the pilot but does not edit LAM."
    },
    {
      "path": "/Users/bennibarger/Developer/HLDPRO/ai-integration-services",
      "reason": "AIS has an active unrelated lane; issue #294 may name it only as a fallback and does not edit it."
    },
    {
      "path": "/Users/bennibarger/Developer/HLDPRO/knocktracker",
      "reason": "Knocktracker has dirty local governance artifacts; issue #294 may name it only as a fallback and does not edit it."
    },
    {
      "path": "/Users/bennibarger/Developer/HLDPRO/HealthcarePlatform",
      "reason": "HealthcarePlatform has an active unrelated branch and modified test files; issue #294 does not edit it."
    }
  ]
}
