{
  "expected_execution_root": ".",
  "expected_branch": "issue-257-som-e2e-enforcement-pdcar",
  "execution_mode": "implementation_ready",
  "allowed_write_paths": [
    "docs/DATA_DICTIONARY.md",
    "docs/FEATURE_REGISTRY.md",
    "docs/plans/issue-257-som-e2e-enforcement-gaps-pdcar.md",
    "docs/plans/issue-257-som-e2e-enforcement-gaps-structured-agent-cycle-plan.json",
    "raw/execution-scopes/2026-04-17-issue-231-e2e-pilot-planning.json",
    "raw/execution-scopes/2026-04-17-issue-257-som-e2e-enforcement-implementation.json",
    "raw/packets/2026-04-17-issue-231-e2e-pilot.yml",
    "scripts/orchestrator/packet_queue.py",
    "scripts/orchestrator/test_packet_queue.py",
    "scripts/overlord/validate_structured_agent_cycle_plan.py",
    "scripts/overlord/test_validate_structured_agent_cycle_plan.py"
  ],
  "forbidden_roots": [
    "/Users/bennibarger/Developer/HLDPRO/hldpro-governance"
  ],
  "handoff_evidence": {
    "status": "accepted",
    "planner_model": "gpt-5.4",
    "implementer_model": "gpt-5.4",
    "accepted_at": "2026-04-17T21:58:00Z",
    "evidence_paths": [
      "docs/plans/issue-257-som-e2e-enforcement-gaps-pdcar.md",
      "docs/plans/issue-257-som-e2e-enforcement-gaps-structured-agent-cycle-plan.json",
      "https://github.com/NIBARGERB-HLDPRO/hldpro-governance/issues/257"
    ],
    "active_exception_ref": "docs/plans/issue-257-som-e2e-enforcement-gaps-pdcar.md#adjust",
    "active_exception_expires_at": "2026-04-24T21:58:00Z"
  }
}
