{
  "expected_execution_root": "{repo_root}",
  "expected_branch": "docs/issue-253-local-ci-gate-runbook-20260417",
  "execution_mode": "planning_only",
  "allowed_write_paths": [
    "OVERLORD_BACKLOG.md",
    "docs/plans/HLD_Pro_Local_CI_Gate_Runbook.md",
    "docs/plans/Local_CI_Gate_Runbook_Reviewer_Response_Memo.md",
    "docs/plans/issue-253-local-ci-gate-runbook-pdcar.md",
    "docs/plans/issue-253-structured-agent-cycle-plan.json",
    "raw/cross-review/2026-04-17-issue-253-local-ci-gate-toolkit-plan.md",
    "raw/execution-scopes/2026-04-17-issue-253-local-ci-gate-toolkit-planning.json"
  ],
  "forbidden_roots": [
    "/Users/bennibarger/Developer/HLDPRO/hldpro-governance"
  ]
}
