{
  "expected_execution_root": "{repo_root}",
  "expected_branch": "issue-310-classification-schema-20260418",
  "execution_mode": "implementation_ready",
  "handoff_evidence": {
    "status": "accepted",
    "planner_model": "gpt-5.4",
    "implementer_model": "gpt-5.4",
    "accepted_at": "2026-04-18T23:55:00Z",
    "evidence_paths": [
      "docs/plans/issue-310-structured-agent-cycle-plan.json",
      "docs/plans/issue-310-governed-repo-classification-schema-pdcar.md",
      "raw/exceptions/2026-04-18-issue-310-same-family-schema.md"
    ],
    "active_exception_ref": "raw/exceptions/2026-04-18-issue-310-same-family-schema.md",
    "active_exception_expires_at": "2026-04-19T23:55:00Z"
  },
  "allowed_write_paths": [
    "docs/governed_repos.json",
    "docs/schemas/governed-repos.schema.json",
    "scripts/overlord/governed_repos.py",
    "scripts/overlord/validate_governed_repos.py",
    "scripts/overlord/test_validate_governed_repos.py",
    "scripts/overlord/check_org_repo_inventory.py",
    "scripts/overlord/test_check_org_repo_inventory.py",
    "docs/DATA_DICTIONARY.md",
    "docs/plans/issue-310-structured-agent-cycle-plan.json",
    "docs/plans/issue-310-governed-repo-classification-schema-pdcar.md",
    "raw/exceptions/2026-04-18-issue-310-same-family-schema.md",
    "raw/cross-review/2026-04-18-issue-310-claude-review.md",
    "raw/execution-scopes/2026-04-18-issue-310-classification-schema-implementation.json",
    "OVERLORD_BACKLOG.md",
    "docs/PROGRESS.md"
  ],
  "forbidden_roots": [
    "/Users/bennibarger/Developer/HLDPRO/hldpro-governance",
    "/Users/bennibarger/Developer/HLDPRO/seek-and-ponder",
    "/Users/bennibarger/Developer/HLDPRO/EmailAssistant",
    "/Users/bennibarger/Developer/HLDPRO/ai-integration-services",
    "/Users/bennibarger/Developer/HLDPRO/HealthcarePlatform",
    "/Users/bennibarger/Developer/HLDPRO/local-ai-machine",
    "/Users/bennibarger/Developer/HLDPRO/knocktracker",
    "/Users/bennibarger/Developer/HLDPRO/ASC-Evaluator"
  ],
  "active_parallel_roots": [
    {
      "path": "/Users/bennibarger/Developer/HLDPRO/hldpro-governance",
      "reason": "Shared main checkout has pre-existing unrelated local CI gate files and must not be edited by issue #310."
    },
    {
      "path": "/Users/bennibarger/Developer/HLDPRO/seek-and-ponder",
      "reason": "Issue #310 defines classification schema only; seek-and-ponder intake is #311."
    },
    {
      "path": "/Users/bennibarger/Developer/HLDPRO/EmailAssistant",
      "reason": "Issue #310 defines classification schema only; EmailAssistant discovery and classification are #312."
    },
    {
      "path": "/Users/bennibarger/Developer/HLDPRO/ai-integration-services",
      "reason": "Existing governed repo is represented by registry metadata only; downstream edits are out of scope."
    },
    {
      "path": "/Users/bennibarger/Developer/HLDPRO/HealthcarePlatform",
      "reason": "Existing governed repo is represented by registry metadata only; downstream edits are out of scope."
    },
    {
      "path": "/Users/bennibarger/Developer/HLDPRO/local-ai-machine",
      "reason": "Existing governed repo is represented by registry metadata only; downstream edits are out of scope."
    },
    {
      "path": "/Users/bennibarger/Developer/HLDPRO/knocktracker",
      "reason": "Existing governed repo is represented by registry metadata only; downstream edits are out of scope."
    },
    {
      "path": "/Users/bennibarger/Developer/HLDPRO/ASC-Evaluator",
      "reason": "Existing governed repo is represented by registry metadata only; downstream edits are out of scope."
    }
  ]
}
