{
  "expected_execution_root": ".",
  "expected_branch": "issue-533-guardrail-epic-closeout",
  "execution_mode": "implementation_ready",
  "allowed_write_paths": [
    "docs/PROGRESS.md",
    "docs/plans/issue-533-session-guardrail-reliability-epic-closeout-pdcar.md",
    "docs/plans/issue-533-session-guardrail-reliability-epic-closeout-structured-agent-cycle-plan.json",
    "raw/closeouts/2026-04-22-issue-533-session-guardrail-reliability-epic-closeout.md",
    "raw/cross-review/2026-04-22-issue-533-session-guardrail-reliability-epic-closeout.md",
    "raw/execution-scopes/2026-04-22-issue-533-session-guardrail-reliability-epic-closeout-implementation.json",
    "raw/exceptions/2026-04-22-issue-533-same-family-epic-closeout.md",
    "raw/handoffs/2026-04-22-issue-533-session-guardrail-reliability-epic-closeout.json",
    "raw/validation/2026-04-22-issue-533-session-guardrail-reliability-epic-closeout.md"
  ],
  "forbidden_roots": [
    "/Users/bennibarger/Developer/HLDPRO/ai-integration-services",
    "/Users/bennibarger/Developer/HLDPRO/HealthcarePlatform",
    "/Users/bennibarger/Developer/HLDPRO/local-ai-machine",
    "/Users/bennibarger/Developer/HLDPRO/knocktracker",
    "/Users/bennibarger/Developer/HLDPRO/ASC-Evaluator",
    "/Users/bennibarger/Developer/HLDPRO/seek-and-ponder",
    "/Users/bennibarger/Developer/HLDPRO/Stampede",
    "/Users/bennibarger/Developer/HLDPRO/hldpro-governance"
  ],
  "active_parallel_roots": [
    {
      "path": "/Users/bennibarger/Developer/HLDPRO/hldpro-governance",
      "reason": "Primary checkout has unrelated dirty work in scripts/pages-deploy/pages_deploy_gate.py; not part of issue #533."
    },
    {
      "path": "/Users/bennibarger/Developer/HLDPRO/ai-integration-services",
      "reason": "Sibling checkout may have unrelated active work; not part of issue #533."
    },
    {
      "path": "/Users/bennibarger/Developer/HLDPRO/HealthcarePlatform",
      "reason": "Sibling checkout may have unrelated active work; not part of issue #533."
    },
    {
      "path": "/Users/bennibarger/Developer/HLDPRO/knocktracker",
      "reason": "Sibling checkout may have unrelated active work; not part of issue #533."
    },
    {
      "path": "/Users/bennibarger/Developer/HLDPRO/seek-and-ponder",
      "reason": "Sibling checkout may have unrelated active work; not part of issue #533."
    },
    {
      "path": "/Users/bennibarger/Developer/HLDPRO/Stampede",
      "reason": "Sibling checkout may have unrelated active work; not part of issue #533."
    }
  ],
  "lane_claim": {
    "issue_number": 533,
    "claim_ref": "https://github.com/NIBARGERB-HLDPRO/hldpro-governance/issues/533#issuecomment-4293131550",
    "claimed_by": "codex",
    "claimed_at": "2026-04-22T03:24:00Z"
  },
  "handoff_evidence": {
    "status": "accepted",
    "planner_model": "codex-orchestrator",
    "implementer_model": "codex-orchestrator",
    "accepted_at": "2026-04-22T03:24:00Z",
    "evidence_paths": [
      "docs/plans/issue-533-session-guardrail-reliability-epic-closeout-pdcar.md",
      "docs/plans/issue-533-session-guardrail-reliability-epic-closeout-structured-agent-cycle-plan.json"
    ],
    "active_exception_ref": "raw/exceptions/2026-04-22-issue-533-same-family-epic-closeout.md",
    "active_exception_expires_at": "2026-04-23T03:24:00Z"
  }
}
