{
  "expected_execution_root": ".",
  "expected_branch": "issue-378-remote-mcp-launchd-live-proof-20260420",
  "execution_mode": "implementation_complete",
  "allowed_write_paths": [
    "OVERLORD_BACKLOG.md",
    "docs/DATA_DICTIONARY.md",
    "docs/FEATURE_REGISTRY.md",
    "docs/PROGRESS.md",
    "docs/SERVICE_REGISTRY.md",
    "docs/plans/issue-378-remote-mcp-launchd-live-proof-pdcar.md",
    "docs/plans/issue-378-remote-mcp-launchd-live-proof-structured-agent-cycle-plan.json",
    "docs/runbooks/remote-mcp-bridge.md",
    "graphify-out/GRAPH_REPORT.md",
    "graphify-out/graph.json",
    "graphify-out/hldpro-governance/",
    "launchd/com.hldpro.remote-mcp-monitor.plist",
    "raw/execution-scopes/2026-04-20-issue-378-remote-mcp-launchd-live-proof-implementation.json",
    "raw/remote-mcp-launchd-live-proof/",
    "raw/validation/2026-04-20-issue-378-remote-mcp-launchd-live-proof.md",
    "raw/closeouts/2026-04-20-issue-378-remote-mcp-launchd-live-proof.md",
    "wiki/"
  ],
  "forbidden_roots": [
    "/Users/bennibarger/Developer/HLDPRO/hldpro-governance",
    "/Users/bennibarger/Developer/HLDPRO/local-ai-machine",
    "/Users/bennibarger/Developer/HLDPRO/ai-integration-services",
    "/Users/bennibarger/Developer/HLDPRO/knocktracker",
    "/Users/bennibarger/Developer/HLDPRO/HealthcarePlatform"
  ],
  "active_parallel_roots": [
    {
      "path": "/Users/bennibarger/Developer/HLDPRO/hldpro-governance",
      "reason": "primary governance checkout is outside issue #378 scope; issue #378 uses an isolated worktree"
    },
    {
      "path": "/Users/bennibarger/Developer/HLDPRO/local-ai-machine",
      "reason": "sibling repo may have unrelated active work outside issue #378 scope"
    },
    {
      "path": "/Users/bennibarger/Developer/HLDPRO/ai-integration-services",
      "reason": "sibling repo may have unrelated active work outside issue #378 scope"
    },
    {
      "path": "/Users/bennibarger/Developer/HLDPRO/knocktracker",
      "reason": "sibling repo may have unrelated active work outside issue #378 scope"
    }
  ],
  "handoff_evidence": {
    "status": "accepted",
    "planner_model": "github-issue-378-and-subagent-explorers",
    "implementer_model": "codex-gpt-5",
    "accepted_at": "2026-04-20T16:20:00Z",
    "evidence_paths": [
      "https://github.com/NIBARGERB-HLDPRO/hldpro-governance/issues/378",
      "docs/plans/issue-378-remote-mcp-launchd-live-proof-structured-agent-cycle-plan.json",
      "docs/plans/issue-378-remote-mcp-launchd-live-proof-pdcar.md"
    ],
    "active_exception_ref": null,
    "active_exception_expires_at": null
  }
}
