{
  "$schema": "../../docs/schemas/execution-scope.schema.json",
  "expected_execution_root": ".",
  "expected_branch": "issue-512-runbook-secret-scrub-20260421",
  "execution_mode": "implementation_ready",
  "allowed_write_paths": [
    "docs/EXTERNAL_SERVICES_RUNBOOK.md",
    "docs/runbooks/remote-mcp-bridge.md",
    "docs/FAIL_FAST_LOG.md",
    "docs/PROGRESS.md",
    "docs/plans/issue-512-runbook-secret-scrub-structured-agent-cycle-plan.json",
    "raw/execution-scopes/2026-04-21-issue-512-runbook-secret-scrub-implementation.json",
    "raw/validation/2026-04-21-issue-512-runbook-secret-scrub.md"
  ],
  "forbidden_roots": [
    "/Users/bennibarger/Developer/HLDPRO/HealthcarePlatform",
    "/Users/bennibarger/Developer/HLDPRO/ai-integration-services",
    "/Users/bennibarger/Developer/HLDPRO/local-ai-machine",
    "/Users/bennibarger/Developer/HLDPRO/knocktracker",
    "/Users/bennibarger/Developer/HLDPRO/ASC-Evaluator",
    "/Users/bennibarger/Developer/HLDPRO/seek-and-ponder",
    "/Users/bennibarger/Developer/HLDPRO/Stampede"
  ],
  "active_parallel_roots": [
    {
      "path": "/Users/bennibarger/Developer/HLDPRO/HealthcarePlatform",
      "reason": "Pre-existing dirty sibling checkout; not part of issue #512."
    },
    {
      "path": "/Users/bennibarger/Developer/HLDPRO/ai-integration-services",
      "reason": "Pre-existing dirty sibling checkout; not part of issue #512."
    },
    {
      "path": "/Users/bennibarger/Developer/HLDPRO/knocktracker",
      "reason": "Pre-existing dirty sibling checkout; not part of issue #512."
    },
    {
      "path": "/Users/bennibarger/Developer/HLDPRO/seek-and-ponder",
      "reason": "Pre-existing dirty sibling checkout; not part of issue #512."
    },
    {
      "path": "/Users/bennibarger/Developer/HLDPRO/Stampede",
      "reason": "Pre-existing dirty sibling checkout; not part of issue #512."
    }
  ],
  "lane_claim": {
    "issue_number": 512,
    "claim_ref": "https://github.com/NIBARGERB-HLDPRO/hldpro-governance/issues/512",
    "claimed_by": "codex-gpt-5",
    "claimed_at": "2026-04-21T00:00:00Z"
  },
  "handoff_evidence": {
    "status": "accepted",
    "planner_model": "operator-brief",
    "implementer_model": "codex-gpt-5",
    "accepted_at": "2026-04-21T00:00:00Z",
    "evidence_paths": [
      "docs/plans/issue-507-secret-provisioning-ux-structured-agent-cycle-plan.json",
      "https://github.com/NIBARGERB-HLDPRO/hldpro-governance/issues/512"
    ],
    "active_exception_ref": null,
    "active_exception_expires_at": null
  }
}
