{
  "expected_execution_root": ".",
  "expected_branch": "issue-632-planning-authority-enforcement-20260430",
  "execution_mode": "planning_only",
  "allowed_write_paths": [
    "docs/plans/issue-632-planning-authority-enforcement-pdcar.md",
    "docs/plans/issue-632-planning-authority-enforcement-structured-agent-cycle-plan.json",
    "raw/closeouts/2026-04-30-issue-632-planning-authority-enforcement.md",
    "raw/execution-scopes/2026-04-30-issue-632-planning-authority-enforcement-planning.json",
    "raw/handoffs/2026-04-30-issue-632-planning-authority-enforcement.json",
    "raw/packets/2026-04-30-issue-632-claude-review-packet.md",
    "raw/cross-review/2026-04-30-issue-632-planning-authority-enforcement-plan.md",
    "docs/codex-reviews/2026-04-30-issue-632-claude.md",
    "raw/validation/2026-04-30-issue-632-planning-authority-enforcement.md"
  ],
  "forbidden_roots": [
    "/Users/bennibarger/Developer/HLDPRO/hldpro-governance",
    "/Users/bennibarger/Developer/HLDPRO/hldpro-governance/var/worktrees/issue-612-cross-family-fallback-enforcement",
    "/Users/bennibarger/Developer/HLDPRO/hldpro-governance/var/worktrees/issue-614-hldpro-sim-verifier-drift-gate",
    "/Users/bennibarger/Developer/HLDPRO/hldpro-governance/var/worktrees/issue-615-prehook-governance-failclosed",
    "/Users/bennibarger/Developer/HLDPRO/hldpro-governance/var/worktrees/issue-631-handoff-dispatch-fallback-parity"
  ],
  "active_parallel_roots": [
    {
      "path": "/Users/bennibarger/Developer/HLDPRO/hldpro-governance",
      "reason": "Primary governance checkout is a separate active root and must not be mutated from the issue-632 planning lane."
    },
    {
      "path": "/Users/bennibarger/Developer/HLDPRO/hldpro-governance/var/worktrees/issue-612-cross-family-fallback-enforcement",
      "reason": "Issue #612 remains the degraded-fallback enforcement lane and must not be mutated from issue #632."
    },
    {
      "path": "/Users/bennibarger/Developer/HLDPRO/hldpro-governance/var/worktrees/issue-614-hldpro-sim-verifier-drift-gate",
      "reason": "Issue #614 remains the hldpro-sim verifier and drift-gate lane and must not be mutated from issue #632."
    },
    {
      "path": "/Users/bennibarger/Developer/HLDPRO/hldpro-governance/var/worktrees/issue-615-prehook-governance-failclosed",
      "reason": "Issue #615 remains the local pre-hook/startup/pretool/root-parity lane and must not be mutated from issue #632."
    },
    {
      "path": "/Users/bennibarger/Developer/HLDPRO/hldpro-governance/var/worktrees/issue-631-handoff-dispatch-fallback-parity",
      "reason": "Issue #631 remains a blocked child under #612 and must not be mixed into issue #632."
    }
  ],
  "lane_claim": {
    "issue_number": 632,
    "claim_ref": "https://github.com/NIBARGERB-HLDPRO/hldpro-governance/issues/632",
    "claimed_by": "codex",
    "claimed_at": "2026-04-30T15:45:00Z"
  }
}
